{
 "format": "rctrack",
 "version": 1,
 "id": "7c002509-b640-5e9d-8e79-0ae336a2ae04",
 "revision": 1,
 "info": {
  "name": "Club A",
  "author": "Yeti",
  "created": "2026-10-13T16:00:00Z",
  "modified": "2026-10-13T16:00:00Z",
  "description": "Built-in Club A layout converted from the grid designer",
  "venue": null,
  "status": "draft",
  "surface": "carpet",
  "classes": [
   "1/10 2WD buggy"
  ],
  "tags": []
 },
 "area": {
  "length": 22,
  "width": 12
 },
 "design": {
  "laneWidth": 2.0,
  "points": [
   {
    "x": 10.0,
    "z": -4.9,
    "radius": 1.0,
    "width": 2.0
   },
   {
    "x": 10.0,
    "z": 4.9,
    "radius": 1.0,
    "width": 2.0
   },
   {
    "x": 1.9,
    "z": 4.9,
    "radius": 0.9,
    "width": 1.8
   },
   {
    "x": 1.9,
    "z": 0.9,
    "radius": 0.9,
    "width": 1.8
   },
   {
    "x": -8.0,
    "z": 0.9,
    "radius": 0.9,
    "width": 1.8
   },
   {
    "x": -8.0,
    "z": 2.8,
    "radius": 1.0,
    "width": 2.0
   },
   {
    "x": 0.0,
    "z": 2.8,
    "radius": 1.0,
    "width": 2.0
   },
   {
    "x": 0.0,
    "z": 4.9,
    "radius": 1.0,
    "width": 2.0
   },
   {
    "x": -10.0,
    "z": 4.9,
    "radius": 1.0,
    "width": 2.0
   },
   {
    "x": -10.0,
    "z": -1.0,
    "radius": 1.0,
    "width": 2.0
   },
   {
    "x": 6.0,
    "z": -1.0,
    "radius": 1.0,
    "width": 2.0
   },
   {
    "x": 6.0,
    "z": 0.9,
    "radius": 0.9,
    "width": 1.8
   },
   {
    "x": 3.9,
    "z": 0.9,
    "radius": 0.9,
    "width": 1.8
   },
   {
    "x": 3.9,
    "z": 2.8,
    "radius": 1.0,
    "width": 2.0
   },
   {
    "x": 8.0,
    "z": 2.8,
    "radius": 1.0,
    "width": 2.0
   },
   {
    "x": 8.0,
    "z": -2.9,
    "radius": 0.9,
    "width": 1.8
   },
   {
    "x": -10.0,
    "z": -2.9,
    "radius": 0.9,
    "width": 1.8
   },
   {
    "x": -10.0,
    "z": -4.9,
    "radius": 1.0,
    "width": 2.0
   }
  ],
  "features": [
   {
    "type": "tabletop",
    "distance": 116.0
   },
   {
    "type": "double",
    "distance": 95.0
   },
   {
    "type": "kicker",
    "distance": 64.0
   }
  ],
  "start": {
   "distance": 109.0
  },
  "rostrum": {
   "side": "north"
  }
 },
 "built": {
  "generator": "rctrack-bake.py 1.1",
  "lapLength": 124.036,
  "racingLine": [
   [
    9.0,
    -4.9,
    2.0
   ],
   [
    9.251,
    -4.868,
    2.0
   ],
   [
    9.485,
    -4.774,
    2.0
   ],
   [
    9.689,
    -4.625,
    2.0
   ],
   [
    9.849,
    -4.429,
    2.0
   ],
   [
    9.954,
    -4.199,
    2.0
   ],
   [
    9.999,
    -3.951,
    2.0
   ],
   [
    10.0,
    -3.7,
    2.0
   ],
   [
    10.0,
    -3.45,
    2.0
   ],
   [
    10.0,
    -3.2,
    2.0
   ],
   [
    10.0,
    -2.95,
    2.0
   ],
   [
    10.0,
    -2.7,
    2.0
   ],
   [
    10.0,
    -2.45,
    2.0
   ],
   [
    10.0,
    -2.2,
    2.0
   ],
   [
    10.0,
    -1.95,
    2.0
   ],
   [
    10.0,
    -1.7,
    2.0
   ],
   [
    10.0,
    -1.45,
    2.0
   ],
   [
    10.0,
    -1.2,
    2.0
   ],
   [
    10.0,
    -0.95,
    2.0
   ],
   [
    10.0,
    -0.7,
    2.0
   ],
   [
    10.0,
    -0.45,
    2.0
   ],
   [
    10.0,
    -0.2,
    2.0
   ],
   [
    10.0,
    0.05,
    2.0
   ],
   [
    10.0,
    0.3,
    2.0
   ],
   [
    10.0,
    0.55,
    2.0
   ],
   [
    10.0,
    0.8,
    2.0
   ],
   [
    10.0,
    1.05,
    2.0
   ],
   [
    10.0,
    1.3,
    2.0
   ],
   [
    10.0,
    1.55,
    2.0
   ],
   [
    10.0,
    1.8,
    2.0
   ],
   [
    10.0,
    2.05,
    2.0
   ],
   [
    10.0,
    2.3,
    2.0
   ],
   [
    10.0,
    2.55,
    2.0
   ],
   [
    10.0,
    2.8,
    2.0
   ],
   [
    10.0,
    3.05,
    2.0
   ],
   [
    10.0,
    3.3,
    2.0
   ],
   [
    10.0,
    3.55,
    2.0
   ],
   [
    10.0,
    3.8,
    2.0
   ],
   [
    9.988,
    4.051,
    2.0
   ],
   [
    9.919,
    4.294,
    2.0
   ],
   [
    9.791,
    4.512,
    2.0
   ],
   [
    9.612,
    4.691,
    2.0
   ],
   [
    9.394,
    4.819,
    2.0
   ],
   [
    9.151,
    4.888,
    2.0
   ],
   [
    8.9,
    4.9,
    1.997
   ],
   [
    8.65,
    4.9,
    1.989
   ],
   [
    8.4,
    4.9,
    1.981
   ],
   [
    8.15,
    4.9,
    1.973
   ],
   [
    7.9,
    4.9,
    1.965
   ],
   [
    7.65,
    4.9,
    1.956
   ],
   [
    7.4,
    4.9,
    1.948
   ],
   [
    7.15,
    4.9,
    1.94
   ],
   [
    6.9,
    4.9,
    1.932
   ],
   [
    6.65,
    4.9,
    1.924
   ],
   [
    6.4,
    4.9,
    1.916
   ],
   [
    6.15,
    4.9,
    1.908
   ],
   [
    5.9,
    4.9,
    1.9
   ],
   [
    5.65,
    4.9,
    1.892
   ],
   [
    5.4,
    4.9,
    1.884
   ],
   [
    5.15,
    4.9,
    1.876
   ],
   [
    4.9,
    4.9,
    1.868
   ],
   [
    4.65,
    4.9,
    1.86
   ],
   [
    4.4,
    4.9,
    1.852
   ],
   [
    4.15,
    4.9,
    1.844
   ],
   [
    3.9,
    4.9,
    1.835
   ],
   [
    3.65,
    4.9,
    1.827
   ],
   [
    3.4,
    4.9,
    1.819
   ],
   [
    3.15,
    4.9,
    1.811
   ],
   [
    2.9,
    4.9,
    1.803
   ],
   [
    2.649,
    4.887,
    1.8
   ],
   [
    2.41,
    4.811,
    1.8
   ],
   [
    2.2,
    4.671,
    1.8
   ],
   [
    2.038,
    4.479,
    1.8
   ],
   [
    1.935,
    4.249,
    1.8
   ],
   [
    1.9,
    4.0,
    1.8
   ],
   [
    1.9,
    3.75,
    1.8
   ],
   [
    1.9,
    3.5,
    1.8
   ],
   [
    1.9,
    3.25,
    1.8
   ],
   [
    1.9,
    3.0,
    1.8
   ],
   [
    1.9,
    2.75,
    1.8
   ],
   [
    1.9,
    2.5,
    1.8
   ],
   [
    1.9,
    2.25,
    1.8
   ],
   [
    1.9,
    2.0,
    1.8
   ],
   [
    1.899,
    1.75,
    1.8
   ],
   [
    1.849,
    1.503,
    1.8
   ],
   [
    1.734,
    1.279,
    1.8
   ],
   [
    1.561,
    1.096,
    1.8
   ],
   [
    1.344,
    0.969,
    1.8
   ],
   [
    1.101,
    0.906,
    1.8
   ],
   [
    0.849,
    0.9,
    1.8
   ],
   [
    0.598,
    0.9,
    1.8
   ],
   [
    0.346,
    0.9,
    1.8
   ],
   [
    0.094,
    0.9,
    1.8
   ],
   [
    -0.157,
    0.9,
    1.8
   ],
   [
    -0.409,
    0.9,
    1.8
   ],
   [
    -0.66,
    0.9,
    1.8
   ],
   [
    -0.912,
    0.9,
    1.8
   ],
   [
    -1.163,
    0.9,
    1.8
   ],
   [
    -1.415,
    0.9,
    1.8
   ],
   [
    -1.666,
    0.9,
    1.8
   ],
   [
    -1.918,
    0.9,
    1.8
   ],
   [
    -2.17,
    0.9,
    1.8
   ],
   [
    -2.421,
    0.9,
    1.8
   ],
   [
    -2.673,
    0.9,
    1.8
   ],
   [
    -2.924,
    0.9,
    1.8
   ],
   [
    -3.176,
    0.9,
    1.8
   ],
   [
    -3.427,
    0.9,
    1.8
   ],
   [
    -3.679,
    0.9,
    1.8
   ],
   [
    -3.93,
    0.9,
    1.8
   ],
   [
    -4.182,
    0.9,
    1.8
   ],
   [
    -4.434,
    0.9,
    1.8
   ],
   [
    -4.685,
    0.9,
    1.8
   ],
   [
    -4.937,
    0.9,
    1.8
   ],
   [
    -5.188,
    0.9,
    1.8
   ],
   [
    -5.44,
    0.9,
    1.8
   ],
   [
    -5.691,
    0.9,
    1.8
   ],
   [
    -5.943,
    0.9,
    1.8
   ],
   [
    -6.194,
    0.9,
    1.8
   ],
   [
    -6.446,
    0.9,
    1.8
   ],
   [
    -6.698,
    0.9,
    1.8
   ],
   [
    -6.949,
    0.9,
    1.8
   ],
   [
    -7.201,
    0.906,
    1.8
   ],
   [
    -7.444,
    0.969,
    1.8
   ],
   [
    -7.661,
    1.096,
    1.8
   ],
   [
    -7.834,
    1.279,
    1.8
   ],
   [
    -7.949,
    1.503,
    1.8
   ],
   [
    -7.999,
    1.75,
    1.8
   ],
   [
    -7.987,
    2.004,
    2.0
   ],
   [
    -7.912,
    2.249,
    2.0
   ],
   [
    -7.774,
    2.465,
    2.0
   ],
   [
    -7.583,
    2.636,
    2.0
   ],
   [
    -7.353,
    2.75,
    2.0
   ],
   [
    -7.101,
    2.799,
    2.0
   ],
   [
    -6.848,
    2.8,
    2.0
   ],
   [
    -6.596,
    2.8,
    2.0
   ],
   [
    -6.344,
    2.8,
    2.0
   ],
   [
    -6.092,
    2.8,
    2.0
   ],
   [
    -5.84,
    2.8,
    2.0
   ],
   [
    -5.588,
    2.8,
    2.0
   ],
   [
    -5.336,
    2.8,
    2.0
   ],
   [
    -5.084,
    2.8,
    2.0
   ],
   [
    -4.832,
    2.8,
    2.0
   ],
   [
    -4.58,
    2.8,
    2.0
   ],
   [
    -4.328,
    2.8,
    2.0
   ],
   [
    -4.075,
    2.8,
    2.0
   ],
   [
    -3.823,
    2.8,
    2.0
   ],
   [
    -3.571,
    2.8,
    2.0
   ],
   [
    -3.319,
    2.8,
    2.0
   ],
   [
    -3.067,
    2.8,
    2.0
   ],
   [
    -2.815,
    2.8,
    2.0
   ],
   [
    -2.563,
    2.8,
    2.0
   ],
   [
    -2.311,
    2.8,
    2.0
   ],
   [
    -2.059,
    2.8,
    2.0
   ],
   [
    -1.807,
    2.8,
    2.0
   ],
   [
    -1.555,
    2.8,
    2.0
   ],
   [
    -1.303,
    2.8,
    2.0
   ],
   [
    -1.05,
    2.8,
    2.0
   ],
   [
    -0.799,
    2.82,
    2.0
   ],
   [
    -0.56,
    2.902,
    2.0
   ],
   [
    -0.349,
    3.041,
    2.0
   ],
   [
    -0.179,
    3.229,
    2.0
   ],
   [
    -0.062,
    3.453,
    2.0
   ],
   [
    -0.005,
    3.699,
    2.0
   ],
   [
    -0.001,
    3.951,
    2.0
   ],
   [
    -0.046,
    4.199,
    2.0
   ],
   [
    -0.151,
    4.429,
    2.0
   ],
   [
    -0.311,
    4.625,
    2.0
   ],
   [
    -0.515,
    4.774,
    2.0
   ],
   [
    -0.749,
    4.868,
    2.0
   ],
   [
    -1.0,
    4.9,
    2.0
   ],
   [
    -1.25,
    4.9,
    2.0
   ],
   [
    -1.5,
    4.9,
    2.0
   ],
   [
    -1.75,
    4.9,
    2.0
   ],
   [
    -2.0,
    4.9,
    2.0
   ],
   [
    -2.25,
    4.9,
    2.0
   ],
   [
    -2.5,
    4.9,
    2.0
   ],
   [
    -2.75,
    4.9,
    2.0
   ],
   [
    -3.0,
    4.9,
    2.0
   ],
   [
    -3.25,
    4.9,
    2.0
   ],
   [
    -3.5,
    4.9,
    2.0
   ],
   [
    -3.75,
    4.9,
    2.0
   ],
   [
    -4.0,
    4.9,
    2.0
   ],
   [
    -4.25,
    4.9,
    2.0
   ],
   [
    -4.5,
    4.9,
    2.0
   ],
   [
    -4.75,
    4.9,
    2.0
   ],
   [
    -5.0,
    4.9,
    2.0
   ],
   [
    -5.25,
    4.9,
    2.0
   ],
   [
    -5.5,
    4.9,
    2.0
   ],
   [
    -5.75,
    4.9,
    2.0
   ],
   [
    -6.0,
    4.9,
    2.0
   ],
   [
    -6.25,
    4.9,
    2.0
   ],
   [
    -6.5,
    4.9,
    2.0
   ],
   [
    -6.75,
    4.9,
    2.0
   ],
   [
    -7.0,
    4.9,
    2.0
   ],
   [
    -7.25,
    4.9,
    2.0
   ],
   [